main_topic,description_1,bill_link,bill_name,current_status,house_progress,senate_progress,after_passage_progress,description_2,sponsors,requester,democrat_sponsor_count,republican_sponsor_count
COMPUTERS,"Digital citizenship, media literacy and, regional conferences on, convening",https://app.leg.wa.gov/billsummary?BillNumber=1365&Year=2021&Initiative=false,Engrossed 2nd Substitute - E2SHB 1365,301 L 21,"['1', '1', '1', '1']","['1', '1', '1', '1']","['1', '1', '1', '1']",Procuring and supporting appropriate computers and devices for public school students and instructional staff.,"Gregerson, Stonier, Ramos, Callan, Simmons, Jesse Johnson, Taylor, Lovick, Leavitt, Ortiz-Self, Berg, Fitzgibbon, Ryu, Morgan, Wicks, Tharinger, Duerr, Ormsby, Hansen, Berry, Dolan, Valdez, Cody, Bronoske, Senn, Bateman, Bergquist, Kloba, Riccelli, Davis, Macri, Ramel, Harris-Talley, Pollet, Sells",No Requester,34,1
COMPUTERS,"Digital citizenship, media literacy and, supporting through school district leadership teams, grant program",https://app.leg.wa.gov/billsummary?BillNumber=5242&Year=2021&Initiative=false,SB 5242,Rules X,"['0', '0', '0', '0']","['0', '0', '0', '0']","['0', '0', '0', '0']",Supporting media literacy and digital citizenship.,"Liias, Short, Frockt, Hunt, Keiser, Nguyen, Saldaña, Claire Wilson",No Requester,7,3
COMPUTERS,"Digital electronic equipment repairability task force, Washington state, establishing",https://app.leg.wa.gov/billsummary?BillNumber=1801&Year=2021&Initiative=false,Substitute - SHB 1801,Approps,"['0', '0', '0', '0']","['0', '0', '0', '0']","['0', '0', '0', '0']",Concerning the repair of digital electronic equipment.,"Gregerson, Ryu, Fitzgibbon, Berry, Cody, Macri, Peterson, Ramel, Wylie, Bergquist, Valdez, Pollet, Stonier, Ormsby, Harris-Talley, Kloba",No Requester,16,1
COMPUTERS,"Digital electronic equipment repairability, commission on, establishing",https://app.leg.wa.gov/billsummary?BillNumber=1801&Year=2021&Initiative=false,Substitute - SHB 1801,Approps,"['0', '0', '0', '0']","['0', '0', '0', '0']","['0', '0', '0', '0']",Concerning the repair of digital electronic equipment.,"Gregerson, Ryu, Fitzgibbon, Berry, Cody, Macri, Peterson, Ramel, Wylie, Bergquist, Valdez, Pollet, Stonier, Ormsby, Harris-Talley, Kloba",No Requester,16,1
COMPUTERS,"Digital electronic equipment, repairability of",https://app.leg.wa.gov/billsummary?BillNumber=1801&Year=2021&Initiative=false,Substitute - SHB 1801,Approps,"['0', '0', '0', '0']","['0', '0', '0', '0']","['0', '0', '0', '0']",Concerning the repair of digital electronic equipment.,"Gregerson, Ryu, Fitzgibbon, Berry, Cody, Macri, Peterson, Ramel, Wylie, Bergquist, Valdez, Pollet, Stonier, Ormsby, Harris-Talley, Kloba",No Requester,16,1
COMPUTERS,"Digital electronic products, repairing of, right-to-repair requirements for manufacturers",https://app.leg.wa.gov/billsummary?BillNumber=5795&Year=2021&Initiative=false,SB 5795,"Environment, E","['0', '0', '0', '0']","['0', '0', '0', '0']","['0', '0', '0', '0']",Concerning the application of the consumer protection act to the fair servicing and repair of manufactured products.,"Hasegawa, Keiser, Pedersen, Saldaña, Stanford",No Requester,5,0
COMPUTERS,"Digital equity account, creating",https://app.leg.wa.gov/billsummary?BillNumber=1723&Year=2021&Initiative=false,Engrossed 2nd Substitute - E2SHB 1723,265 L 22,"['1', '1', '1', '1']","['1', '1', '1', '1']","['1', '1', '1', '1']","Closing the digital equity divide by increasing the accessibility and affordability of telecommunications services, devices, and training.","Gregerson, Taylor, Ryu, Jesse Johnson, Berry, Valdez, Goodman, Macri, Peterson, Ramel, Simmons, Wylie, Slatter, Bergquist, Pollet, Ortiz-Self, Dolan, Stonier, Riccelli, Ormsby, Harris-Talley, Hackney, Kloba, Frame",No Requester,24,1
COMPUTERS,"Digital equity and inclusion, competitive grant program to advance",https://app.leg.wa.gov/billsummary?BillNumber=1723&Year=2021&Initiative=false,Engrossed 2nd Substitute - E2SHB 1723,265 L 22,"['1', '1', '1', '1']","['1', '1', '1', '1']","['1', '1', '1', '1']","Closing the digital equity divide by increasing the accessibility and affordability of telecommunications services, devices, and training.","Gregerson, Taylor, Ryu, Jesse Johnson, Berry, Valdez, Goodman, Macri, Peterson, Ramel, Simmons, Wylie, Slatter, Bergquist, Pollet, Ortiz-Self, Dolan, Stonier, Riccelli, Ormsby, Harris-Talley, Hackney, Kloba, Frame",No Requester,24,1
COMPUTERS,"Digital equity and inclusion, for underserved populations, advancing",https://app.leg.wa.gov/billsummary?BillNumber=1723&Year=2021&Initiative=false,Engrossed 2nd Substitute - E2SHB 1723,265 L 22,"['1', '1', '1', '1']","['1', '1', '1', '1']","['1', '1', '1', '1']","Closing the digital equity divide by increasing the accessibility and affordability of telecommunications services, devices, and training.","Gregerson, Taylor, Ryu, Jesse Johnson, Berry, Valdez, Goodman, Macri, Peterson, Ramel, Simmons, Wylie, Slatter, Bergquist, Pollet, Ortiz-Self, Dolan, Stonier, Riccelli, Ormsby, Harris-Talley, Hackney, Kloba, Frame",No Requester,24,1
COMPUTERS,"Digital equity forum, establishing",https://app.leg.wa.gov/billsummary?BillNumber=1723&Year=2021&Initiative=false,Engrossed 2nd Substitute - E2SHB 1723,265 L 22,"['1', '1', '1', '1']","['1', '1', '1', '1']","['1', '1', '1', '1']","Closing the digital equity divide by increasing the accessibility and affordability of telecommunications services, devices, and training.","Gregerson, Taylor, Ryu, Jesse Johnson, Berry, Valdez, Goodman, Macri, Peterson, Ramel, Simmons, Wylie, Slatter, Bergquist, Pollet, Ortiz-Self, Dolan, Stonier, Riccelli, Ormsby, Harris-Talley, Hackney, Kloba, Frame",No Requester,24,1
COMPUTERS,"Digital equity opportunity program, creating",https://app.leg.wa.gov/billsummary?BillNumber=1723&Year=2021&Initiative=false,Engrossed 2nd Substitute - E2SHB 1723,265 L 22,"['1', '1', '1', '1']","['1', '1', '1', '1']","['1', '1', '1', '1']","Closing the digital equity divide by increasing the accessibility and affordability of telecommunications services, devices, and training.","Gregerson, Taylor, Ryu, Jesse Johnson, Berry, Valdez, Goodman, Macri, Peterson, Ramel, Simmons, Wylie, Slatter, Bergquist, Pollet, Ortiz-Self, Dolan, Stonier, Riccelli, Ormsby, Harris-Talley, Hackney, Kloba, Frame",No Requester,24,1
COMPUTERS,"Digital equity plan, developing",https://app.leg.wa.gov/billsummary?BillNumber=1723&Year=2021&Initiative=false,Engrossed 2nd Substitute - E2SHB 1723,265 L 22,"['1', '1', '1', '1']","['1', '1', '1', '1']","['1', '1', '1', '1']","Closing the digital equity divide by increasing the accessibility and affordability of telecommunications services, devices, and training.","Gregerson, Taylor, Ryu, Jesse Johnson, Berry, Valdez, Goodman, Macri, Peterson, Ramel, Simmons, Wylie, Slatter, Bergquist, Pollet, Ortiz-Self, Dolan, Stonier, Riccelli, Ormsby, Harris-Talley, Hackney, Kloba, Frame",No Requester,24,1
COMPUTERS,"Digital equity planning grant program, creating",https://app.leg.wa.gov/billsummary?BillNumber=1723&Year=2021&Initiative=false,Engrossed 2nd Substitute - E2SHB 1723,265 L 22,"['1', '1', '1', '1']","['1', '1', '1', '1']","['1', '1', '1', '1']","Closing the digital equity divide by increasing the accessibility and affordability of telecommunications services, devices, and training.","Gregerson, Taylor, Ryu, Jesse Johnson, Berry, Valdez, Goodman, Macri, Peterson, Ramel, Simmons, Wylie, Slatter, Bergquist, Pollet, Ortiz-Self, Dolan, Stonier, Riccelli, Ormsby, Harris-Talley, Hackney, Kloba, Frame",No Requester,24,1
COMPUTERS,"Digital equity, anchor institution digital equity program, establishing",https://app.leg.wa.gov/billsummary?BillNumber=1723&Year=2021&Initiative=false,Engrossed 2nd Substitute - E2SHB 1723,265 L 22,"['1', '1', '1', '1']","['1', '1', '1', '1']","['1', '1', '1', '1']","Closing the digital equity divide by increasing the accessibility and affordability of telecommunications services, devices, and training.","Gregerson, Taylor, Ryu, Jesse Johnson, Berry, Valdez, Goodman, Macri, Peterson, Ramel, Simmons, Wylie, Slatter, Bergquist, Pollet, Ortiz-Self, Dolan, Stonier, Riccelli, Ormsby, Harris-Talley, Hackney, Kloba, Frame",No Requester,24,1
COMPUTERS,"Digital goods and digital codes, shop local and save sales and use tax holiday to include",https://app.leg.wa.gov/billsummary?BillNumber=2018&Year=2021&Initiative=false,Engrossed Substitute - ESHB 2018,Rules 3C,"['0', '0', '0', '0']","['0', '0', '0', '0']","['0', '0', '0', '0']","Creating a three-day shop local and save sales and use tax holiday to benefit all Washington families for certain items $1,000 or less during the month of September.","Paul, Rule, Bergquist, Bronoske, Chapman, Leavitt, Ramel, Ryu, Sutherland, Berg, Callan, Frame, Riccelli, Lekanoff",No Requester,13,1
COMPUTERS,"Digital product and other purchases by DOT, sales/use tax amounts paid to general fund for",https://app.leg.wa.gov/billsummary?BillNumber=1249&Year=2021&Initiative=false,HB 1249,Approps,"['0', '0', '0', '0']","['0', '0', '0', '0']","['0', '0', '0', '0']",Concerning sales tax revenues of transportation projects being used for transportation purposes with at least 70 percent being deposited into the motor vehicle fund.,"Orcutt, Eslick, Sutherland, Barkis",No Requester,0,4
COMPUTERS,"Doxing of personally identifiable information, gross misdemeanor",https://app.leg.wa.gov/billsummary?BillNumber=5881&Year=2021&Initiative=false,SB 5881,Law & Justice,"['0', '0', '0', '0']","['0', '0', '0', '0']","['0', '0', '0', '0']",Concerning doxing.,"Lovick, Pedersen, Claire Wilson",No Requester,3,2
COMPUTERS,"Electronic media, use by elected county officials for continuity of operations",https://app.leg.wa.gov/billsummary?BillNumber=1271&Year=2021&Initiative=false,Engrossed - EHB 1271,122 L 21,"['1', '1', '1', '1']","['1', '1', '1', '1']","['1', '1', '1', '1']",Ensuring continuity of operations in the offices of county elected officials during the current COVID-19 pandemic and future public health crises.,"Orwall, Goehner, Goodman, Thai, Fey, Pollet, Harris-Talley",No Requester,6,2
COMPUTERS,"Information technology, state agency, independent security assessment of audits of, contracting for",https://app.leg.wa.gov/billsummary?BillNumber=5432&Year=2021&Initiative=false,Engrossed Substitute - ESSB 5432,291 L 21,"['1', '1', '1', '1']","['1', '1', '1', '1']","['1', '1', '1', '1']",Concerning cybersecurity and data sharing in Washington state government.,"Carlyle, Nguyen, Conway, Das, Dhingra, Keiser, Liias, Nobles, Randall",Office of the Governor,9,0
COMPUTERS,"Internet access tax, on internet access service subscriptions, imposing",https://app.leg.wa.gov/billsummary?BillNumber=1460&Year=2021&Initiative=false,2nd Substitute - 2SHB 1460,Rules C,"['0', '0', '0', '0']","['0', '0', '0', '0']","['0', '0', '0', '0']",Closing the digital divide by establishing excise taxes on telecommunications services to fund the expansion of the universal service programs in Washington.,"Gregerson, Taylor, Simmons, Jesse Johnson, Lekanoff, Santos, Slatter, Dolan, Peterson, Callan, Ormsby, Morgan, Bateman, Bergquist, Ramel, Thai, Valdez, Pollet, Lovick, Macri, Chopp, Hackney, Ortiz-Self, Riccelli, Kloba, Harris-Talley",No Requester,26,1
COMPUTERS,"Internet activity, secret surveillance scores based on, agencies/organizations creating, requirements",https://app.leg.wa.gov/billsummary?BillNumber=5108&Year=2021&Initiative=false,SB 5108,Law & Justice,"['0', '0', '0', '0']","['0', '0', '0', '0']","['0', '0', '0', '0']",Concerning organizations and agencies that produce secret surveillance scores based on individuals' internet activity.,"Ericksen, Holy",No Requester,0,1
COMPUTERS,"Internet crimes against children task force, recommendations of, implementing",https://app.leg.wa.gov/billsummary?BillNumber=5572&Year=2021&Initiative=false,Substitute - SSB 5572,Rules 3,"['0', '0', '0', '0']","['0', '0', '0', '0']","['0', '0', '0', '0']",Implementing the recommendations of the Washington state internet crimes against children task force.,"Claire Wilson, Dhingra, Conway, Honeyford, Hunt, Randall, Wagoner",No Requester,5,4
COMPUTERS,"Internet, access to, increasing via telecommunications permitting/taxation/standards modifications",https://app.leg.wa.gov/billsummary?BillNumber=5110&Year=2021&Initiative=false,SB 5110,"Environment, E","['0', '0', '0', '0']","['0', '0', '0', '0']","['0', '0', '0', '0']","Promoting greater access to the internet by modifying permitting, taxation, and other standards for telecommunications companies and facilities.",Ericksen,No Requester,0,0
COMPUTERS,"Internet, broadband services, adoption of, creating digital equity opportunity program to advance",https://app.leg.wa.gov/billsummary?BillNumber=1723&Year=2021&Initiative=false,Engrossed 2nd Substitute - E2SHB 1723,265 L 22,"['1', '1', '1', '1']","['1', '1', '1', '1']","['1', '1', '1', '1']","Closing the digital equity divide by increasing the accessibility and affordability of telecommunications services, devices, and training.","Gregerson, Taylor, Ryu, Jesse Johnson, Berry, Valdez, Goodman, Macri, Peterson, Ramel, Simmons, Wylie, Slatter, Bergquist, Pollet, Ortiz-Self, Dolan, Stonier, Riccelli, Ormsby, Harris-Talley, Hackney, Kloba, Frame",No Requester,24,1
COMPUTERS,"Internet, broadband services, anchor institution digital equity program, establishing",https://app.leg.wa.gov/billsummary?BillNumber=1723&Year=2021&Initiative=false,Engrossed 2nd Substitute - E2SHB 1723,265 L 22,"['1', '1', '1', '1']","['1', '1', '1', '1']","['1', '1', '1', '1']","Closing the digital equity divide by increasing the accessibility and affordability of telecommunications services, devices, and training.","Gregerson, Taylor, Ryu, Jesse Johnson, Berry, Valdez, Goodman, Macri, Peterson, Ramel, Simmons, Wylie, Slatter, Bergquist, Pollet, Ortiz-Self, Dolan, Stonier, Riccelli, Ormsby, Harris-Talley, Hackney, Kloba, Frame",No Requester,24,1
COMPUTERS,"Internet, broadband services, open access networks, grant/loan program for developing",https://app.leg.wa.gov/billsummary?BillNumber=5586&Year=2021&Initiative=false,SB 5586,"Business, Fina","['0', '0', '0', '0']","['0', '0', '0', '0']","['0', '0', '0', '0']",Concerning the authority of the community economic revitalization board.,"Frockt, Hasegawa, Mullet, Nguyen",No Requester,4,0
COMPUTERS,"Internet, broadband services, provider data caps during state of emergency, prohibiting",https://app.leg.wa.gov/billsummary?BillNumber=5470&Year=2021&Initiative=false,SB 5470,"Environment, E","['0', '0', '0', '0']","['0', '0', '0', '0']","['0', '0', '0', '0']",Prohibiting broadband internet access service providers from applying data caps during a state of emergency.,"Rivers, Nguyen, Linda Wilson",No Requester,2,3
COMPUTERS,"Internet, broadband services, providing to unserved areas via infrastructure, tax credits for",https://app.leg.wa.gov/billsummary?BillNumber=5110&Year=2021&Initiative=false,SB 5110,"Environment, E","['0', '0', '0', '0']","['0', '0', '0', '0']","['0', '0', '0', '0']","Promoting greater access to the internet by modifying permitting, taxation, and other standards for telecommunications companies and facilities.",Ericksen,No Requester,0,0
COMPUTERS,"Internet, broadband services, retail, in unserved areas, provided by public entities, authority/process for",https://app.leg.wa.gov/billsummary?BillNumber=1336&Year=2021&Initiative=false,Engrossed Substitute - ESHB 1336,294 L 21,"['1', '1', '1', '1']","['1', '1', '1', '1']","['1', '1', '1', '1']",Creating and expanding unrestricted authority for public entities to provide telecommunications services to end users.,"Hansen, Ybarra, Berry, Simmons, Ramel, Valdez, Leavitt, Morgan, Ryu, Peterson, Shewmake, Davis, Ormsby, Gilday, Stonier, Eslick, Pollet, Harris-Talley",No Requester,14,4
COMPUTERS,"Internet, broadband services, retail, in unserved areas, provided by public utility districts, authority/process for",https://app.leg.wa.gov/billsummary?BillNumber=5383&Year=2021&Initiative=false,2nd Substitute - 2SSB 5383,293 L 21,"['1', '1', '1', '1']","['1', '1', '1', '1']","['1', '1', '1', '1']",Authorizing a public utility district to provide retail telecommunications services in unserved areas under certain conditions.,"Wellman, Short, Hunt, King, Lovelett, Nguyen, Randall, Saldaña, Warnick, Claire Wilson, Linda Wilson",No Requester,7,5
COMPUTERS,"Internet, broadband services, retail, in unserved areas, provided by PUDs/port districts, authority/process for",https://app.leg.wa.gov/billsummary?BillNumber=5383&Year=2021&Initiative=false,2nd Substitute - 2SSB 5383,293 L 21,"['1', '1', '1', '1']","['1', '1', '1', '1']","['1', '1', '1', '1']",Authorizing a public utility district to provide retail telecommunications services in unserved areas under certain conditions.,"Wellman, Short, Hunt, King, Lovelett, Nguyen, Randall, Saldaña, Warnick, Claire Wilson, Linda Wilson",No Requester,7,5
COMPUTERS,"Internet, broadband services, virtual private network service, provider to offer",https://app.leg.wa.gov/billsummary?BillNumber=5112&Year=2021&Initiative=false,SB 5112,"Environment, E","['0', '0', '0', '0']","['0', '0', '0', '0']","['0', '0', '0', '0']",Requiring broadband internet access service providers to provide virtual private network service.,Ericksen,No Requester,0,0
COMPUTERS,"Internet, broadband services, Washington broadband assistance program, establishing",https://app.leg.wa.gov/billsummary?BillNumber=1723&Year=2021&Initiative=false,Engrossed 2nd Substitute - E2SHB 1723,265 L 22,"['1', '1', '1', '1']","['1', '1', '1', '1']","['1', '1', '1', '1']","Closing the digital equity divide by increasing the accessibility and affordability of telecommunications services, devices, and training.","Gregerson, Taylor, Ryu, Jesse Johnson, Berry, Valdez, Goodman, Macri, Peterson, Ramel, Simmons, Wylie, Slatter, Bergquist, Pollet, Ortiz-Self, Dolan, Stonier, Riccelli, Ormsby, Harris-Talley, Hackney, Kloba, Frame",No Requester,24,1
COMPUTERS,"Internet, broadband services, wholesale telecommunications services provided by PUDs, authority for, when",https://app.leg.wa.gov/billsummary?BillNumber=5383&Year=2021&Initiative=false,2nd Substitute - 2SSB 5383,293 L 21,"['1', '1', '1', '1']","['1', '1', '1', '1']","['1', '1', '1', '1']",Authorizing a public utility district to provide retail telecommunications services in unserved areas under certain conditions.,"Wellman, Short, Hunt, King, Lovelett, Nguyen, Randall, Saldaña, Warnick, Claire Wilson, Linda Wilson",No Requester,7,5
COMPUTERS,"Internet, high-speed, infrastructure for unserved rural-county regions, sales/use tax revenue use for",https://app.leg.wa.gov/billsummary?BillNumber=1246&Year=2021&Initiative=false,HB 1246,Finance,"['0', '0', '0', '0']","['0', '0', '0', '0']","['0', '0', '0', '0']",Allowing a local sales and use tax as a credit against the state sales tax for rural high-speed internet infrastructure without increasing the total sales and use tax rate.,"Orcutt, Young",No Requester,0,2
COMPUTERS,"Internet, high-speed, real estate seller's disclosure of access availability",https://app.leg.wa.gov/billsummary?BillNumber=1064&Year=2021&Initiative=false,Substitute - SHB 1064,25 L 21,"['1', '1', '1', '1']","['1', '1', '1', '1']","['1', '1', '1', '1']",Requiring the disclosure of high-speed internet access availability in the seller's disclosure statement.,"Eslick, Kloba, Leavitt, Wylie, Gregerson, Ryu, Young, Robertson, Kirby, Fey",No Requester,7,3
COMPUTERS,"Internet, marketing/advertising products or services to minors via, prohibitions",https://app.leg.wa.gov/billsummary?BillNumber=1697&Year=2021&Initiative=false,Substitute - SHB 1697,Approps,"['0', '0', '0', '0']","['0', '0', '0', '0']","['0', '0', '0', '0']",Concerning privacy rights for Washington minors.,"Leavitt, Ramel, Berg, Callan, Slatter, Pollet",No Requester,6,0
COMPUTERS,"Internet, state resources, state employee use for social gatherings during pandemic, when",https://app.leg.wa.gov/billsummary?BillNumber=5395&Year=2021&Initiative=false,Engrossed 2nd Substitute - E2SSB 5395,Rules X,"['0', '0', '0', '0']","['0', '0', '0', '0']","['0', '0', '0', '0']",Concerning use of state resources during periods where state employees are required to work from home.,"Hunt, Dhingra, Hasegawa, Kuderer, Nguyen, Nobles, Randall, Saldaña, Wellman, Claire Wilson",No Requester,10,2
COMPUTERS,"Learning devices, digital navigator program for school and families training and technical support",https://app.leg.wa.gov/billsummary?BillNumber=1450&Year=2021&Initiative=false,HB 1450,Education,"['0', '0', '0', '0']","['0', '0', '0', '0']","['0', '0', '0', '0']","Procuring, and supporting the use of, appropriate computers and devices for public school students and instructional staff by levying a tax on wireless devices.","Gregerson, Stonier, Tharinger, Dolan, Fitzgibbon, Hansen, Lovick, Berry, Callan, Ryu, Taylor, Davis, Wicks, Simmons, Valdez, Senn, Jesse Johnson, Ramel, Kloba, Bergquist, Ormsby, Riccelli, Pollet, Ortiz-Self, Duerr, Hackney, Thai, Berg, Harris-Talley, Macri",No Requester,29,1
COMPUTERS,"Learning devices, student learning device grant program, establishing, OSPI role",https://app.leg.wa.gov/billsummary?BillNumber=1450&Year=2021&Initiative=false,HB 1450,Education,"['0', '0', '0', '0']","['0', '0', '0', '0']","['0', '0', '0', '0']","Procuring, and supporting the use of, appropriate computers and devices for public school students and instructional staff by levying a tax on wireless devices.","Gregerson, Stonier, Tharinger, Dolan, Fitzgibbon, Hansen, Lovick, Berry, Callan, Ryu, Taylor, Davis, Wicks, Simmons, Valdez, Senn, Jesse Johnson, Ramel, Kloba, Bergquist, Ormsby, Riccelli, Pollet, Ortiz-Self, Duerr, Hackney, Thai, Berg, Harris-Talley, Macri",No Requester,29,1
COMPUTERS,"Learning devices, technology consultation/procurement/training for local school districts",https://app.leg.wa.gov/billsummary?BillNumber=1365&Year=2021&Initiative=false,Engrossed 2nd Substitute - E2SHB 1365,301 L 21,"['1', '1', '1', '1']","['1', '1', '1', '1']","['1', '1', '1', '1']",Procuring and supporting appropriate computers and devices for public school students and instructional staff.,"Gregerson, Stonier, Ramos, Callan, Simmons, Jesse Johnson, Taylor, Lovick, Leavitt, Ortiz-Self, Berg, Fitzgibbon, Ryu, Morgan, Wicks, Tharinger, Duerr, Ormsby, Hansen, Berry, Dolan, Valdez, Cody, Bronoske, Senn, Bateman, Bergquist, Kloba, Riccelli, Davis, Macri, Ramel, Harris-Talley, Pollet, Sells",No Requester,34,1
COMPUTERS,"Learning devices, technology grant program, establishing, OSPI role",https://app.leg.wa.gov/billsummary?BillNumber=1365&Year=2021&Initiative=false,Engrossed 2nd Substitute - E2SHB 1365,301 L 21,"['1', '1', '1', '1']","['1', '1', '1', '1']","['1', '1', '1', '1']",Procuring and supporting appropriate computers and devices for public school students and instructional staff.,"Gregerson, Stonier, Ramos, Callan, Simmons, Jesse Johnson, Taylor, Lovick, Leavitt, Ortiz-Self, Berg, Fitzgibbon, Ryu, Morgan, Wicks, Tharinger, Duerr, Ormsby, Hansen, Berry, Dolan, Valdez, Cody, Bronoske, Senn, Bateman, Bergquist, Kloba, Riccelli, Davis, Macri, Ramel, Harris-Talley, Pollet, Sells",No Requester,34,1
COMPUTERS,"Learning devices/computers/peripheral devices, procurement program for schools",https://app.leg.wa.gov/billsummary?BillNumber=1450&Year=2021&Initiative=false,HB 1450,Education,"['0', '0', '0', '0']","['0', '0', '0', '0']","['0', '0', '0', '0']","Procuring, and supporting the use of, appropriate computers and devices for public school students and instructional staff by levying a tax on wireless devices.","Gregerson, Stonier, Tharinger, Dolan, Fitzgibbon, Hansen, Lovick, Berry, Callan, Ryu, Taylor, Davis, Wicks, Simmons, Valdez, Senn, Jesse Johnson, Ramel, Kloba, Bergquist, Ormsby, Riccelli, Pollet, Ortiz-Self, Duerr, Hackney, Thai, Berg, Harris-Talley, Macri",No Requester,29,1
COMPUTERS,"Online marketplaces, high-volume third-party sellers on, requirements",https://app.leg.wa.gov/billsummary?BillNumber=5533&Year=2021&Initiative=false,SB 5533,"Environment, E","['0', '0', '0', '0']","['0', '0', '0', '0']","['0', '0', '0', '0']",Concerning online marketplace consumer product theft and safety protection.,"Keiser, King, Conway, Dhingra, Kuderer, Lovick, Randall, Rivers, Schoesler, Claire Wilson",No Requester,7,5
COMPUTERS,"Personal data, businesses controlling/processing, Washington foundational data privacy act",https://app.leg.wa.gov/billsummary?BillNumber=1850&Year=2021&Initiative=false,2nd Substitute - 2SHB 1850,Rules/RET,"['0', '0', '0', '0']","['0', '0', '0', '0']","['0', '0', '0', '0']",Protecting and enforcing the foundational data privacy rights of Washingtonians.,"Slatter, Berg, Pollet, Harris-Talley",No Requester,4,1
COMPUTERS,"Personal data, businesses controlling/processing, Washington privacy act",https://app.leg.wa.gov/billsummary?BillNumber=5062&Year=2021&Initiative=false,2nd Substitute - 2SSB 5062,Rules 3,"['0', '0', '0', '0']","['0', '0', '0', '0']","['0', '0', '0', '0']","Concerning the management, oversight, and use of data.","Carlyle, Nguyen, Billig, Darneille, Das, Dhingra, Holy, Hunt, Lovelett, Mullet, Pedersen, Salomon, Sheldon, Wellman, Claire Wilson",No Requester,13,3
COMPUTERS,"Personal data, regarding public health emergency, privacy in private and public sectors",https://app.leg.wa.gov/billsummary?BillNumber=5062&Year=2021&Initiative=false,2nd Substitute - 2SSB 5062,Rules 3,"['0', '0', '0', '0']","['0', '0', '0', '0']","['0', '0', '0', '0']","Concerning the management, oversight, and use of data.","Carlyle, Nguyen, Billig, Darneille, Das, Dhingra, Holy, Hunt, Lovelett, Mullet, Pedersen, Salomon, Sheldon, Wellman, Claire Wilson",No Requester,13,3
