main_topic,description_1,bill_link,bill_name,current_status,house_progress,senate_progress,after_passage_progress,description_2,sponsors,requester,democrat_sponsor_count,republican_sponsor_count
COMPUTERS,"Personal data, Washington state consumer data privacy commission, creating",https://app.leg.wa.gov/billsummary?BillNumber=1850&Year=2021&Initiative=false,2nd Substitute - 2SHB 1850,Rules/RET,"['0', '0', '0', '0']","['0', '0', '0', '0']","['0', '0', '0', '0']",Protecting and enforcing the foundational data privacy rights of Washingtonians.,"Slatter, Berg, Pollet, Harris-Talley",No Requester,4,1
COMPUTERS,"Personal information, captured biometric, people's privacy act provisions concerning",https://app.leg.wa.gov/billsummary?BillNumber=1433&Year=2021&Initiative=false,HB 1433,Civil R & Judi,"['0', '0', '0', '0']","['0', '0', '0', '0']","['0', '0', '0', '0']",Creating a charter of people's personal data rights.,"Kloba, Sutherland, Ryu, Jesse Johnson, Valdez, Dolan, Young, Ramel, Bergquist, Eslick, Jacobsen, Harris-Talley",No Requester,9,5
COMPUTERS,"Personal information, captured, processing by business entities, individual's rights and opt-in consent for",https://app.leg.wa.gov/billsummary?BillNumber=1433&Year=2021&Initiative=false,HB 1433,Civil R & Judi,"['0', '0', '0', '0']","['0', '0', '0', '0']","['0', '0', '0', '0']",Creating a charter of people's personal data rights.,"Kloba, Sutherland, Ryu, Jesse Johnson, Valdez, Dolan, Young, Ramel, Bergquist, Eslick, Jacobsen, Harris-Talley",No Requester,9,5
COMPUTERS,"Personal information, captured, processing by business entities, people's privacy act concerning",https://app.leg.wa.gov/billsummary?BillNumber=1433&Year=2021&Initiative=false,HB 1433,Civil R & Judi,"['0', '0', '0', '0']","['0', '0', '0', '0']","['0', '0', '0', '0']",Creating a charter of people's personal data rights.,"Kloba, Sutherland, Ryu, Jesse Johnson, Valdez, Dolan, Young, Ramel, Bergquist, Eslick, Jacobsen, Harris-Talley",No Requester,9,5
COMPUTERS,"Personal information, digital data breach reimbursement claims program, creating",https://app.leg.wa.gov/billsummary?BillNumber=5462&Year=2021&Initiative=false,SB 5462,"Environment, E","['0', '0', '0', '0']","['0', '0', '0', '0']","['0', '0', '0', '0']",Concerning claims due to a breach of the security of a state database or information technology system.,Honeyford,No Requester,0,1
COMPUTERS,"Personal information, state digital data breach account, creating",https://app.leg.wa.gov/billsummary?BillNumber=5462&Year=2021&Initiative=false,SB 5462,"Environment, E","['0', '0', '0', '0']","['0', '0', '0', '0']","['0', '0', '0', '0']",Concerning claims due to a breach of the security of a state database or information technology system.,Honeyford,No Requester,0,1
COMPUTERS,"Personal/sensitive data, data brokers processing/acquiring, consumer consent/rights and broker requirements",https://app.leg.wa.gov/billsummary?BillNumber=5813&Year=2021&Initiative=false,SB 5813,"Environment, E","['0', '0', '0', '0']","['0', '0', '0', '0']","['0', '0', '0', '0']","Establishing data privacy protections to strengthen a consumer's ability to access, manage, and protect their personal data.","Carlyle, Nguyen, Liias, Lovick, Pedersen",No Requester,5,0
COMPUTERS,"Personal/sensitive data, of children/adolescents, collection/processing of, consent/rights/assessments/duties",https://app.leg.wa.gov/billsummary?BillNumber=5813&Year=2021&Initiative=false,SB 5813,"Environment, E","['0', '0', '0', '0']","['0', '0', '0', '0']","['0', '0', '0', '0']","Establishing data privacy protections to strengthen a consumer's ability to access, manage, and protect their personal data.","Carlyle, Nguyen, Liias, Lovick, Pedersen",No Requester,5,0
COMPUTERS,"Personal/sensitive data, processing for targeted advertising and sale, consumer right to opt out of",https://app.leg.wa.gov/billsummary?BillNumber=5813&Year=2021&Initiative=false,SB 5813,"Environment, E","['0', '0', '0', '0']","['0', '0', '0', '0']","['0', '0', '0', '0']","Establishing data privacy protections to strengthen a consumer's ability to access, manage, and protect their personal data.","Carlyle, Nguyen, Liias, Lovick, Pedersen",No Requester,5,0
COMPUTERS,"Personally identifiable information, doxing of, gross misdemeanor",https://app.leg.wa.gov/billsummary?BillNumber=5881&Year=2021&Initiative=false,SB 5881,Law & Justice,"['0', '0', '0', '0']","['0', '0', '0', '0']","['0', '0', '0', '0']",Concerning doxing.,"Lovick, Pedersen, Claire Wilson",No Requester,3,2
COMPUTERS,"Public schools, technology equity gaps in, state plan for reducing",https://app.leg.wa.gov/billsummary?BillNumber=1450&Year=2021&Initiative=false,HB 1450,Education,"['0', '0', '0', '0']","['0', '0', '0', '0']","['0', '0', '0', '0']","Procuring, and supporting the use of, appropriate computers and devices for public school students and instructional staff by levying a tax on wireless devices.","Gregerson, Stonier, Tharinger, Dolan, Fitzgibbon, Hansen, Lovick, Berry, Callan, Ryu, Taylor, Davis, Wicks, Simmons, Valdez, Senn, Jesse Johnson, Ramel, Kloba, Bergquist, Ormsby, Riccelli, Pollet, Ortiz-Self, Duerr, Hackney, Thai, Berg, Harris-Talley, Macri",No Requester,29,1
COMPUTERS,"Ransomware education and outreach program, for public agencies, establishing",https://app.leg.wa.gov/billsummary?BillNumber=5916&Year=2021&Initiative=false,SB 5916,"Environment, E","['0', '0', '0', '0']","['0', '0', '0', '0']","['0', '0', '0', '0']",Concerning the protection of critical constituent and state operational data against the financial and personal harm caused by ransomware and other malicious cyber activities.,"Mullet, Conway, Fortunato, Nguyen, Wagoner",No Requester,3,2
COMPUTERS,"Ransomware protection act, Washington state",https://app.leg.wa.gov/billsummary?BillNumber=5916&Year=2021&Initiative=false,SB 5916,"Environment, E","['0', '0', '0', '0']","['0', '0', '0', '0']","['0', '0', '0', '0']",Concerning the protection of critical constituent and state operational data against the financial and personal harm caused by ransomware and other malicious cyber activities.,"Mullet, Conway, Fortunato, Nguyen, Wagoner",No Requester,3,2
COMPUTERS,"RCW and WAC, electronic versions of, reformatting to indicate subsection/subparagraph indentation levels",https://app.leg.wa.gov/billsummary?BillNumber=1230&Year=2021&Initiative=false,HB 1230,Civil R & Judi,"['0', '0', '0', '0']","['0', '0', '0', '0']","['0', '0', '0', '0']",Requiring formatting changes to the electronic versions of the Revised Code of Washington and the Washington Administrative Code.,Stokesbary,No Requester,0,1
COMPUTERS,"Repairability, digital electronic equipment, commission on, establishing",https://app.leg.wa.gov/billsummary?BillNumber=1801&Year=2021&Initiative=false,Substitute - SHB 1801,Approps,"['0', '0', '0', '0']","['0', '0', '0', '0']","['0', '0', '0', '0']",Concerning the repair of digital electronic equipment.,"Gregerson, Ryu, Fitzgibbon, Berry, Cody, Macri, Peterson, Ramel, Wylie, Bergquist, Valdez, Pollet, Stonier, Ormsby, Harris-Talley, Kloba",No Requester,16,1
COMPUTERS,"Repairability, digital electronic equipment, repairability index act",https://app.leg.wa.gov/billsummary?BillNumber=1801&Year=2021&Initiative=false,Substitute - SHB 1801,Approps,"['0', '0', '0', '0']","['0', '0', '0', '0']","['0', '0', '0', '0']",Concerning the repair of digital electronic equipment.,"Gregerson, Ryu, Fitzgibbon, Berry, Cody, Macri, Peterson, Ramel, Wylie, Bergquist, Valdez, Pollet, Stonier, Ormsby, Harris-Talley, Kloba",No Requester,16,1
COMPUTERS,"Repairability, digital electronic equipment, Washington state task force, establishing",https://app.leg.wa.gov/billsummary?BillNumber=1801&Year=2021&Initiative=false,Substitute - SHB 1801,Approps,"['0', '0', '0', '0']","['0', '0', '0', '0']","['0', '0', '0', '0']",Concerning the repair of digital electronic equipment.,"Gregerson, Ryu, Fitzgibbon, Berry, Cody, Macri, Peterson, Ramel, Wylie, Bergquist, Valdez, Pollet, Stonier, Ormsby, Harris-Talley, Kloba",No Requester,16,1
COMPUTERS,"Repairing digital electronic products, right-to-repair requirements for manufacturers",https://app.leg.wa.gov/billsummary?BillNumber=5795&Year=2021&Initiative=false,SB 5795,"Environment, E","['0', '0', '0', '0']","['0', '0', '0', '0']","['0', '0', '0', '0']",Concerning the application of the consumer protection act to the fair servicing and repair of manufactured products.,"Hasegawa, Keiser, Pedersen, Saldaña, Stanford",No Requester,5,0
COMPUTERS,"Schools, graduation requirements, substituting computer science for 3rd-year math or science course",https://app.leg.wa.gov/billsummary?BillNumber=5299&Year=2021&Initiative=false,SB 5299,307 L 21,"['1', '1', '1', '1']","['1', '1', '1', '1']","['1', '1', '1', '1']",Allowing the use of computer science credits for the purpose of graduation requirements.,"Wellman, Kuderer, Hunt, Mullet, Nguyen, Claire Wilson",No Requester,6,2
COMPUTERS,"Teachers, certificated, endorsements in elementary and secondary computer science, developing standards for",https://app.leg.wa.gov/billsummary?BillNumber=5389&Year=2021&Initiative=false,SB 5389,Ways & Means,"['0', '0', '0', '0']","['0', '0', '0', '0']","['0', '0', '0', '0']",Creating teaching endorsements in computer science.,"Wellman, Nobles, Hunt, Nguyen, Randall, Saldaña, Stanford, Claire Wilson",No Requester,8,2
COMPUTERS,"Virtual setting, with video conferencing, holding regular/special public agency meetings in",https://app.leg.wa.gov/billsummary?BillNumber=1180&Year=2021&Initiative=false,HB 1180,Local Govt,"['0', '0', '0', '0']","['0', '0', '0', '0']","['0', '0', '0', '0']","Concerning public testimony at public meetings, including virtual meetings.","Kraft, Sutherland",No Requester,0,2
COMPUTERS,"Vlogs, for-profit, of family or individual vlogger, minor children featured on, setting aside earnings on video content for",https://app.leg.wa.gov/billsummary?BillNumber=2032&Year=2021&Initiative=false,HB 2032,Civil R & Judi,"['0', '0', '0', '0']","['0', '0', '0', '0']","['0', '0', '0', '0']",Protecting the interests of minor children featured on for-profit family vlogs.,"Wicks, Berry, Sells, Senn, Eslick",No Requester,4,1
